{
  "constraints": [
    {
      "id": "c000000",
      "rhs": 3,
      "sense": "eq",
      "source": "balance/initial_stock/routes/recipes",
      "terms": [
        {
          "coefficient": 1,
          "var": "inventory:W0:P0:0:0"
        },
        {
          "coefficient": 1,
          "var": "ship:R_W0_H0_standard:P0:0:0"
        }
      ],
      "type": "linear"
    },
    {
      "id": "c000001",
      "rhs": 2,
      "sense": "eq",
      "source": "balance/initial_stock/routes/recipes",
      "terms": [
        {
          "coefficient": 1,
          "var": "inventory:W1:P0:0:0"
        },
        {
          "coefficient": 1,
          "var": "ship:R_W1_H0_standard:P0:0:0"
        }
      ],
      "type": "linear"
    },
    {
      "id": "c000002",
      "rhs": 0,
      "sense": "eq",
      "source": "balance/initial_stock/routes/recipes",
      "terms": [
        {
          "coefficient": 1,
          "var": "inventory:H0:P0:0:0"
        },
        {
          "coefficient": 1,
          "var": "ship:R_H0_M0_standard:P0:0:0"
        },
        {
          "coefficient": -1,
          "var": "ship:R_W0_H0_standard:P0:0:0"
        },
        {
          "coefficient": -1,
          "var": "ship:R_W1_H0_standard:P0:0:0"
        }
      ],
      "type": "linear"
    },
    {
      "id": "c000003",
      "rhs": 0,
      "sense": "eq",
      "source": "balance/initial_stock/routes/recipes",
      "terms": [
        {
          "coefficient": 1,
          "var": "inventory:M0:P0:0:0"
        },
        {
          "coefficient": 1,
          "var": "serve:M0:P0:0:0"
        },
        {
          "coefficient": -1,
          "var": "ship:R_H0_M0_standard:P0:0:0"
        }
      ],
      "type": "linear"
    },
    {
      "id": "c000004",
      "rhs": 3,
      "sense": "eq",
      "source": "demands",
      "terms": [
        {
          "coefficient": 1,
          "var": "serve:M0:P0:0:0"
        }
      ],
      "type": "linear"
    },
    {
      "id": "c000005",
      "rhs": 3,
      "sense": "le",
      "source": "locations/storage_capacity",
      "terms": [
        {
          "coefficient": 1,
          "var": "inventory:W0:P0:0:0"
        }
      ],
      "type": "linear"
    },
    {
      "id": "c000006",
      "rhs": 3,
      "sense": "le",
      "source": "locations/throughput_capacity",
      "terms": [
        {
          "coefficient": 1,
          "var": "ship:R_W0_H0_standard:P0:0:0"
        }
      ],
      "type": "linear"
    },
    {
      "id": "c000007",
      "rhs": 4,
      "sense": "le",
      "source": "locations/storage_capacity",
      "terms": [
        {
          "coefficient": 1,
          "var": "inventory:W1:P0:0:0"
        }
      ],
      "type": "linear"
    },
    {
      "id": "c000008",
      "rhs": 0,
      "sense": "le",
      "source": "locations/throughput_capacity",
      "terms": [
        {
          "coefficient": 1,
          "var": "ship:R_W1_H0_standard:P0:0:0"
        }
      ],
      "type": "linear"
    },
    {
      "id": "c000009",
      "rhs": 3,
      "sense": "le",
      "source": "locations/storage_capacity",
      "terms": [
        {
          "coefficient": 1,
          "var": "inventory:H0:P0:0:0"
        }
      ],
      "type": "linear"
    },
    {
      "id": "c000010",
      "rhs": 4,
      "sense": "le",
      "source": "locations/throughput_capacity",
      "terms": [
        {
          "coefficient": 1,
          "var": "ship:R_H0_M0_standard:P0:0:0"
        }
      ],
      "type": "linear"
    },
    {
      "id": "c000011",
      "rhs": 0,
      "sense": "le",
      "source": "locations/storage_capacity",
      "terms": [
        {
          "coefficient": 1,
          "var": "inventory:M0:P0:0:0"
        }
      ],
      "type": "linear"
    },
    {
      "id": "c000012",
      "rhs": 2,
      "sense": "le",
      "source": "locations/throughput_capacity",
      "terms": [],
      "type": "linear"
    },
    {
      "id": "c000013",
      "rhs": 6,
      "sense": "le",
      "source": "routes/capacity",
      "terms": [
        {
          "coefficient": 1,
          "var": "ship:R_H0_M0_standard:P0:0:0"
        }
      ],
      "type": "linear"
    },
    {
      "id": "c000014",
      "rhs": 6,
      "sense": "le",
      "source": "routes/capacity",
      "terms": [
        {
          "coefficient": 1,
          "var": "ship:R_W0_H0_standard:P0:0:0"
        }
      ],
      "type": "linear"
    },
    {
      "id": "c000015",
      "rhs": 6,
      "sense": "le",
      "source": "routes/capacity",
      "terms": [
        {
          "coefficient": 1,
          "var": "ship:R_W1_H0_standard:P0:0:0"
        }
      ],
      "type": "linear"
    }
  ],
  "objective": {
    "constant": 0,
    "sense": "min",
    "terms": [
      {
        "coefficient": 8,
        "var": "ship:R_H0_M0_standard:P0:0:0"
      },
      {
        "coefficient": 10,
        "var": "ship:R_W0_H0_standard:P0:0:0"
      },
      {
        "coefficient": 11,
        "var": "ship:R_W1_H0_standard:P0:0:0"
      }
    ]
  },
  "schema_version": "1.0.0",
  "variables": [
    {
      "kind": "integer",
      "lower": 0,
      "meaning": [
        "inventory",
        "H0",
        "P0",
        0,
        0
      ],
      "name": "inventory:H0:P0:0:0",
      "unit": "item",
      "upper": 5
    },
    {
      "kind": "integer",
      "lower": 0,
      "meaning": [
        "inventory",
        "M0",
        "P0",
        0,
        0
      ],
      "name": "inventory:M0:P0:0:0",
      "unit": "item",
      "upper": 5
    },
    {
      "kind": "integer",
      "lower": 0,
      "meaning": [
        "inventory",
        "W0",
        "P0",
        0,
        0
      ],
      "name": "inventory:W0:P0:0:0",
      "unit": "item",
      "upper": 5
    },
    {
      "kind": "integer",
      "lower": 0,
      "meaning": [
        "inventory",
        "W1",
        "P0",
        0,
        0
      ],
      "name": "inventory:W1:P0:0:0",
      "unit": "item",
      "upper": 5
    },
    {
      "kind": "integer",
      "lower": 0,
      "meaning": [
        "serve",
        "M0",
        "P0",
        0,
        0
      ],
      "name": "serve:M0:P0:0:0",
      "unit": "item",
      "upper": 3
    },
    {
      "kind": "integer",
      "lower": 0,
      "meaning": [
        "ship",
        "R_H0_M0_standard",
        "P0",
        0,
        0
      ],
      "name": "ship:R_H0_M0_standard:P0:0:0",
      "unit": "item",
      "upper": 5
    },
    {
      "kind": "integer",
      "lower": 0,
      "meaning": [
        "ship",
        "R_W0_H0_standard",
        "P0",
        0,
        0
      ],
      "name": "ship:R_W0_H0_standard:P0:0:0",
      "unit": "item",
      "upper": 5
    },
    {
      "kind": "integer",
      "lower": 0,
      "meaning": [
        "ship",
        "R_W1_H0_standard",
        "P0",
        0,
        0
      ],
      "name": "ship:R_W1_H0_standard:P0:0:0",
      "unit": "item",
      "upper": 5
    }
  ]
}
